dig_code,dig_desc,sig_code_12,sig_code_07,sig_desc_07,sig_desc_12
111200,Vegetable and melon farming,111CA,110C,Farms,Farms
111300,Fruit and tree nut farming,111CA,110C,Farms,Farms
111400,"Greenhouse, nursery, and floriculture production",111CA,110C,Farms,Farms
111900,Other crop farming,111CA,110C,Farms,Farms
112120,Dairy cattle and milk production,111CA,110C,Farms,Farms
112300,Poultry and egg production,111CA,110C,Farms,Farms
113000,Forestry and logging,113FF,113F,"Forestry, fishing, and related activities","Forestry, fishing, and related activities"
114000,"Fishing, hunting and trapping",113FF,113F,"Forestry, fishing, and related activities","Forestry, fishing, and related activities"
115000,Support activities for agriculture and forestry,113FF,113F,"Forestry, fishing, and related activities","Forestry, fishing, and related activities"
211000,Oil and gas extraction,211,2110,Oil and gas extraction,Oil and gas extraction
212100,Coal mining,212,2120,"Mining, except oil and gas","Mining, except oil and gas"
212230,"Copper, nickel, lead, and zinc mining",212,2120,"Mining, except oil and gas","Mining, except oil and gas"
212310,Stone mining and quarrying,212,2120,"Mining, except oil and gas","Mining, except oil and gas"
213111,Drilling oil and gas wells,213,2130,Support activities for mining,Support activities for mining
221100,"Electric power generation, transmission, and distribution",22,2200,Utilities,Utilities
221200,Natural gas distribution,22,2200,Utilities,Utilities
221300,"Water, sewage and other systems",22,2200,Utilities,Utilities
230301,Nonresidential maintenance and repair,23,2300,Construction,Construction
230302,Residential maintenance and repair,23,2300,Construction,Construction
233210,Health care structures,23,2300,Construction,Construction
233230,Manufacturing structures,23,2300,Construction,Construction
233240,Power and communication structures,23,2300,Construction,Construction
233262,Educational and vocational structures,23,2300,Construction,Construction
233411,Single-family residential structures,23,2300,Construction,Construction
233412,Multifamily residential structures,23,2300,Construction,Construction
311111,Dog and cat food manufacturing,311FT,311A,"Food, beverage, and tobacco products",Food and beverage and tobacco products
311119,Other animal food manufacturing,311FT,311A,"Food, beverage, and tobacco products",Food and beverage and tobacco products
311210,Flour milling and malt manufacturing,311FT,311A,"Food, beverage, and tobacco products",Food and beverage and tobacco products
311221,Wet corn milling,311FT,311A,"Food, beverage, and tobacco products",Food and beverage and tobacco products
311225,Fats and oils refining and blending,311FT,311A,"Food, beverage, and tobacco products",Food and beverage and tobacco products
311230,Breakfast cereal manufacturing,311FT,311A,"Food, beverage, and tobacco products",Food and beverage and tobacco products
311300,Sugar and confectionery product manufacturing,311FT,311A,"Food, beverage, and tobacco products",Food and beverage and tobacco products
311410,Frozen food manufacturing,311FT,311A,"Food, beverage, and tobacco products",Food and beverage and tobacco products
311420,"Fruit and vegetable canning, pickling, and drying",311FT,311A,"Food, beverage, and tobacco products",Food and beverage and tobacco products
311513,Cheese manufacturing,311FT,311A,"Food, beverage, and tobacco products",Food and beverage and tobacco products
311514,"Dry, condensed, and evaporated dairy product manufacturing",311FT,311A,"Food, beverage, and tobacco products",Food and beverage and tobacco products
311520,Ice cream and frozen dessert manufacturing,311FT,311A,"Food, beverage, and tobacco products",Food and beverage and tobacco products
311615,Poultry processing,311FT,311A,"Food, beverage, and tobacco products",Food and beverage and tobacco products
311700,Seafood product preparation and packaging,311FT,311A,"Food, beverage, and tobacco products",Food and beverage and tobacco products
311810,Bread and bakery product manufacturing,311FT,311A,"Food, beverage, and tobacco products",Food and beverage and tobacco products
311910,Snack food manufacturing,311FT,311A,"Food, beverage, and tobacco products",Food and beverage and tobacco products
311920,Coffee and tea manufacturing,311FT,311A,"Food, beverage, and tobacco products",Food and beverage and tobacco products
311930,Flavoring syrup and concentrate manufacturing,311FT,311A,"Food, beverage, and tobacco products",Food and beverage and tobacco products
311940,Seasoning and dressing manufacturing,311FT,311A,"Food, beverage, and tobacco products",Food and beverage and tobacco products
311990,All other food manufacturing,311FT,311A,"Food, beverage, and tobacco products",Food and beverage and tobacco products
312110,Soft drink and ice manufacturing,311FT,311A,"Food, beverage, and tobacco products",Food and beverage and tobacco products
312120,Breweries,311FT,311A,"Food, beverage, and tobacco products",Food and beverage and tobacco products
312130,Wineries,311FT,311A,"Food, beverage, and tobacco products",Food and beverage and tobacco products
312140,Distilleries,311FT,311A,"Food, beverage, and tobacco products",Food and beverage and tobacco products
312200,Tobacco product manufacturing,311FT,311A,"Food, beverage, and tobacco products",Food and beverage and tobacco products
313100,"Fiber, yarn, and thread mills",313TT,313T,Textile mills and textile product mills,Textile mills and textile product mills
313200,Fabric mills,313TT,313T,Textile mills and textile product mills,Textile mills and textile product mills
313300,Textile and fabric finishing and fabric coating mills,313TT,313T,Textile mills and textile product mills,Textile mills and textile product mills
314110,Carpet and rug mills,313TT,313T,Textile mills and textile product mills,Textile mills and textile product mills
314120,Curtain and linen mills,313TT,313T,Textile mills and textile product mills,Textile mills and textile product mills
314900,Other textile product mills,313TT,313T,Textile mills and textile product mills,Textile mills and textile product mills
315000,Apparel manufacturing,315AL,315A,Apparel and leather and allied products,Apparel and leather and allied products
316000,Leather and allied product manufacturing,315AL,315A,Apparel and leather and allied products,Apparel and leather and allied products
321100,Sawmills and wood preservation,321,3210,Wood products,Wood products
321200,"Veneer, plywood, and engineered wood product manufacturing",321,3210,Wood products,Wood products
321910,Millwork,321,3210,Wood products,Wood products
322110,Pulp mills,322,3220,Paper products,Paper products
322120,Paper mills,322,3220,Paper products,Paper products
322130,Paperboard mills,322,3220,Paper products,Paper products
322210,Paperboard container manufacturing,322,3220,Paper products,Paper products
322220,Paper Bag and Coated and Treated Paper Manufacturing,322,3220,Paper products,Paper products
322230,Stationery product manufacturing,322,3220,Paper products,Paper products
322291,Sanitary paper product manufacturing,322,3220,Paper products,Paper products
322299,All other converted paper product manufacturing,322,3220,Paper products,Paper products
323110,Printing,323,3230,Printing and related support activities,Printing and related support activities
323120,Support activities for printing,323,3230,Printing and related support activities,Printing and related support activities
324110,Petroleum refineries,324,3240,Petroleum and coal products,Petroleum and coal products
324121,Asphalt paving mixture and block manufacturing,324,3240,Petroleum and coal products,Petroleum and coal products
324122,Asphalt shingle and coating materials manufacturing,324,3240,Petroleum and coal products,Petroleum and coal products
324190,Other petroleum and coal products manufacturing,324,3240,Petroleum and coal products,Petroleum and coal products
325110,Petrochemical manufacturing,325,3250,Chemical products,Chemical products
325120,Industrial gas manufacturing,325,3250,Chemical products,Chemical products
325130,Synthetic dye and pigment manufacturing,325,3250,Chemical products,Chemical products
325180,Other Basic Inorganic Chemical Manufacturing,325,3250,Chemical products,Chemical products
325190,Other basic organic chemical manufacturing,325,3250,Chemical products,Chemical products
325211,Plastics material and resin manufacturing,325,3250,Chemical products,Chemical products
325310,Fertilizer manufacturing,325,3250,Chemical products,Chemical products
325320,Pesticide and other agricultural chemical manufacturing,325,3250,Chemical products,Chemical products
325411,Medicinal and botanical manufacturing,325,3250,Chemical products,Chemical products
325412,Pharmaceutical preparation manufacturing,325,3250,Chemical products,Chemical products
325413,In-vitro diagnostic substance manufacturing,325,3250,Chemical products,Chemical products
325414,Biological product (except diagnostic) manufacturing,325,3250,Chemical products,Chemical products
325510,Paint and coating manufacturing,325,3250,Chemical products,Chemical products
325520,Adhesive manufacturing,325,3250,Chemical products,Chemical products
325610,Soap and cleaning compound manufacturing,325,3250,Chemical products,Chemical products
325620,Toilet preparation manufacturing,325,3250,Chemical products,Chemical products
325910,Printing ink manufacturing,325,3250,Chemical products,Chemical products
326110,Plastics packaging materials and unlaminated film and sheet manufacturing,326,3260,Plastics and rubber products,Plastics and rubber products
326120,"Plastics pipe, pipe fitting, and unlaminated profile shape manufacturing",326,3260,Plastics and rubber products,Plastics and rubber products
326130,"Laminated plastics plate, sheet (except packaging), and shape manufacturing",326,3260,Plastics and rubber products,Plastics and rubber products
326140,Polystyrene foam product manufacturing,326,3260,Plastics and rubber products,Plastics and rubber products
326150,Urethane and other foam product (except polystyrene) manufacturing,326,3260,Plastics and rubber products,Plastics and rubber products
326160,Plastics bottle manufacturing,326,3260,Plastics and rubber products,Plastics and rubber products
326190,Other plastics product manufacturing,326,3260,Plastics and rubber products,Plastics and rubber products
326210,Tire manufacturing,326,3260,Plastics and rubber products,Plastics and rubber products
326220,Rubber and plastics hoses and belting manufacturing,326,3260,Plastics and rubber products,Plastics and rubber products
326290,Other rubber product manufacturing,326,3260,Plastics and rubber products,Plastics and rubber products
327100,Clay product and refractory manufacturing,327,3270,Nonmetallic mineral products,Nonmetallic mineral products
327200,Glass and glass product manufacturing,327,3270,Nonmetallic mineral products,Nonmetallic mineral products
327310,Cement manufacturing,327,3270,Nonmetallic mineral products,Nonmetallic mineral products
327320,Ready-mix concrete manufacturing,327,3270,Nonmetallic mineral products,Nonmetallic mineral products
327330,"Concrete pipe, brick, and block manufacturing",327,3270,Nonmetallic mineral products,Nonmetallic mineral products
327390,Other concrete product manufacturing,327,3270,Nonmetallic mineral products,Nonmetallic mineral products
327400,Lime and gypsum product manufacturing,327,3270,Nonmetallic mineral products,Nonmetallic mineral products
327910,Abrasive product manufacturing,327,3270,Nonmetallic mineral products,Nonmetallic mineral products
327991,Cut stone and stone product manufacturing,327,3270,Nonmetallic mineral products,Nonmetallic mineral products
327992,Ground or treated mineral and earth manufacturing,327,3270,Nonmetallic mineral products,Nonmetallic mineral products
327993,Mineral wool manufacturing,327,3270,Nonmetallic mineral products,Nonmetallic mineral products
327999,Miscellaneous nonmetallic mineral products,327,3270,Nonmetallic mineral products,Nonmetallic mineral products
331110,Iron and steel mills and ferroalloy manufacturing,331,3310,Primary metals,Primary metals
331200,Steel product manufacturing from purchased steel,331,3310,Primary metals,Primary metals
331314,Secondary smelting and alloying of aluminum,331,3310,Primary metals,Primary metals
331420,"Copper rolling, drawing, extruding and alloying",331,3310,Primary metals,Primary metals
331490,"Nonferrous metal (except copper and aluminum) rolling, drawing, extruding and alloying",331,3310,Primary metals,Primary metals
331510,Ferrous metal foundries,331,3310,Primary metals,Primary metals
331520,Nonferrous metal foundries,331,3310,Primary metals,Primary metals
332114,Custom roll forming,332,3320,Fabricated metal products,Fabricated metal products
332200,Cutlery and handtool manufacturing,332,3320,Fabricated metal products,Fabricated metal products
332310,Plate work and fabricated structural product manufacturing,332,3320,Fabricated metal products,Fabricated metal products
332320,Ornamental and architectural metal products manufacturing,332,3320,Fabricated metal products,Fabricated metal products
332410,Power boiler and heat exchanger manufacturing,332,3320,Fabricated metal products,Fabricated metal products
332420,Metal tank (heavy gauge) manufacturing,332,3320,Fabricated metal products,Fabricated metal products
332430,"Metal can, box, and other metal container (light gauge) manufacturing",332,3320,Fabricated metal products,Fabricated metal products
332500,Hardware manufacturing,332,3320,Fabricated metal products,Fabricated metal products
332600,Spring and wire product manufacturing,332,3320,Fabricated metal products,Fabricated metal products
332710,Machine shops,332,3320,Fabricated metal products,Fabricated metal products
332720,"Turned product and screw, nut, and bolt manufacturing",332,3320,Fabricated metal products,Fabricated metal products
332800,"Coating, engraving, heat treating and allied activities",332,3320,Fabricated metal products,Fabricated metal products
332913,Plumbing fixture fitting and trim manufacturing,332,3320,Fabricated metal products,Fabricated metal products
332991,Ball and roller bearing manufacturing,332,3320,Fabricated metal products,Fabricated metal products
332996,Fabricated pipe and pipe fitting manufacturing,332,3320,Fabricated metal products,Fabricated metal products
333111,Farm machinery and equipment manufacturing,333,3330,Machinery,Machinery
333112,Lawn and garden equipment manufacturing,333,3330,Machinery,Machinery
333120,Construction machinery manufacturing,333,3330,Machinery,Machinery
333130,Mining and oil and gas field machinery manufacturing,333,3330,Machinery,Machinery
333314,Optical instrument and lens manufacturing,333,3330,Machinery,Machinery
333414,Heating equipment (except warm air furnaces) manufacturing,333,3330,Machinery,Machinery
333415,"Air conditioning, refrigeration, and warm air heating equipment manufacturing",333,3330,Machinery,Machinery
333511,Industrial mold manufacturing,333,3330,Machinery,Machinery
333514,"Special tool, die, jig, and fixture manufacturing",333,3330,Machinery,Machinery
333611,Turbine and turbine generator set units manufacturing,333,3330,Machinery,Machinery
333612,"Speed changer, industrial high-speed drive, and gear manufacturing",333,3330,Machinery,Machinery
333613,Mechanical power transmission equipment manufacturing,333,3330,Machinery,Machinery
333618,Other engine equipment manufacturing,333,3330,Machinery,Machinery
333912,Air and gas compressor manufacturing,333,3330,Machinery,Machinery
333920,Material handling equipment manufacturing,333,3330,Machinery,Machinery
333991,Power-driven handtool manufacturing,333,3330,Machinery,Machinery
333993,Packaging machinery manufacturing,333,3330,Machinery,Machinery
333994,Industrial process furnace and oven manufacturing,333,3330,Machinery,Machinery
334111,Electronic computer manufacturing,334,3340,Computer and electronic products,Computer and electronic products
334112,Computer storage device manufacturing,334,3340,Computer and electronic products,Computer and electronic products
334210,Telephone apparatus manufacturing,334,3340,Computer and electronic products,Computer and electronic products
334220,Broadcast and wireless communications equipment,334,3340,Computer and electronic products,Computer and electronic products
334290,Other communications equipment manufacturing,334,3340,Computer and electronic products,Computer and electronic products
334300,Audio and video equipment manufacturing,334,3340,Computer and electronic products,Computer and electronic products
334413,Semiconductor and related device manufacturing,334,3340,Computer and electronic products,Computer and electronic products
334418,Printed circuit assembly (electronic assembly) manufacturing,334,3340,Computer and electronic products,Computer and electronic products
334510,Electromedical and electrotherapeutic apparatus manufacturing,334,3340,Computer and electronic products,Computer and electronic products
334511,"Search, detection, and navigation instruments manufacturing",334,3340,Computer and electronic products,Computer and electronic products
334512,Automatic environmental control manufacturing,334,3340,Computer and electronic products,Computer and electronic products
334513,Industrial process variable instruments manufacturing,334,3340,Computer and electronic products,Computer and electronic products
334514,Totalizing fluid meter and counting device manufacturing,334,3340,Computer and electronic products,Computer and electronic products
334515,Electricity and signal testing instruments manufacturing,334,3340,Computer and electronic products,Computer and electronic products
334516,Analytical laboratory instrument manufacturing,334,3340,Computer and electronic products,Computer and electronic products
334517,Irradiation apparatus manufacturing,334,3340,Computer and electronic products,Computer and electronic products
334610,Manufacturing and reproducing magnetic and optical media,334,3340,Computer and electronic products,Computer and electronic products
335110,Electric lamp bulb and part manufacturing,335,3350,"Electrical equipment, appliances, and components","Electrical equipment, appliances, and components"
335120,Lighting fixture manufacturing,335,3350,"Electrical equipment, appliances, and components","Electrical equipment, appliances, and components"
335210,Small electrical appliance manufacturing,335,3350,"Electrical equipment, appliances, and components","Electrical equipment, appliances, and components"
335221,Household cooking appliance manufacturing,335,3350,"Electrical equipment, appliances, and components","Electrical equipment, appliances, and components"
335222,Household refrigerator and home freezer manufacturing,335,3350,"Electrical equipment, appliances, and components","Electrical equipment, appliances, and components"
335224,Household laundry equipment manufacturing,335,3350,"Electrical equipment, appliances, and components","Electrical equipment, appliances, and components"
335228,Other major household appliance manufacturing,335,3350,"Electrical equipment, appliances, and components","Electrical equipment, appliances, and components"
335311,"Power, distribution, and specialty transformer manufacturing",335,3350,"Electrical equipment, appliances, and components","Electrical equipment, appliances, and components"
335312,Motor and generator manufacturing,335,3350,"Electrical equipment, appliances, and components","Electrical equipment, appliances, and components"
335313,Switchgear and switchboard apparatus manufacturing,335,3350,"Electrical equipment, appliances, and components","Electrical equipment, appliances, and components"
335314,Relay and industrial control manufacturing,335,3350,"Electrical equipment, appliances, and components","Electrical equipment, appliances, and components"
335911,Storage battery manufacturing,335,3350,"Electrical equipment, appliances, and components","Electrical equipment, appliances, and components"
335912,Primary battery manufacturing,335,3350,"Electrical equipment, appliances, and components","Electrical equipment, appliances, and components"
335920,Communication and energy wire and cable manufacturing,335,3350,"Electrical equipment, appliances, and components","Electrical equipment, appliances, and components"
335930,Wiring device manufacturing,335,3350,"Electrical equipment, appliances, and components","Electrical equipment, appliances, and components"
335991,Carbon and graphite product manufacturing,335,3350,"Electrical equipment, appliances, and components","Electrical equipment, appliances, and components"
335999,All other miscellaneous electrical equipment and component manufacturing,335,3350,"Electrical equipment, appliances, and components","Electrical equipment, appliances, and components"
336111,Automobile manufacturing,3361MV,336M,"Motor vehicles, bodies and trailers, and parts","Motor vehicles, bodies and trailers, and parts"
336112,Light truck and utility vehicle manufacturing,3361MV,336M,"Motor vehicles, bodies and trailers, and parts","Motor vehicles, bodies and trailers, and parts"
336120,Heavy duty truck manufacturing,3361MV,336M,"Motor vehicles, bodies and trailers, and parts","Motor vehicles, bodies and trailers, and parts"
336211,Motor vehicle body manufacturing,3361MV,336M,"Motor vehicles, bodies and trailers, and parts","Motor vehicles, bodies and trailers, and parts"
336212,Truck trailer manufacturing,3361MV,336M,"Motor vehicles, bodies and trailers, and parts","Motor vehicles, bodies and trailers, and parts"
336213,Motor home manufacturing,3361MV,336M,"Motor vehicles, bodies and trailers, and parts","Motor vehicles, bodies and trailers, and parts"
336214,Travel trailer and camper manufacturing,3361MV,336M,"Motor vehicles, bodies and trailers, and parts","Motor vehicles, bodies and trailers, and parts"
336310,Motor vehicle gasoline engine and engine parts manufacturing,3361MV,336M,"Motor vehicles, bodies and trailers, and parts","Motor vehicles, bodies and trailers, and parts"
336320,Motor vehicle electrical and electronic equipment manufacturing,3361MV,336M,"Motor vehicles, bodies and trailers, and parts","Motor vehicles, bodies and trailers, and parts"
336350,Motor vehicle transmission and power train parts manufacturing,3361MV,336M,"Motor vehicles, bodies and trailers, and parts","Motor vehicles, bodies and trailers, and parts"
336360,Motor vehicle seating and interior trim manufacturing,3361MV,336M,"Motor vehicles, bodies and trailers, and parts","Motor vehicles, bodies and trailers, and parts"
336370,Motor vehicle metal stamping,3361MV,336M,"Motor vehicles, bodies and trailers, and parts","Motor vehicles, bodies and trailers, and parts"
336390,Other Motor Vehicle Parts Manufacturing,3361MV,336M,"Motor vehicles, bodies and trailers, and parts","Motor vehicles, bodies and trailers, and parts"
336411,Aircraft manufacturing,3364OT,336O,Other transportation equipment,Other transportation equipment
336412,Aircraft engine and engine parts manufacturing,3364OT,336O,Other transportation equipment,Other transportation equipment
336413,Other aircraft parts and auxiliary equipment manufacturing,3364OT,336O,Other transportation equipment,Other transportation equipment
336414,Guided missile and space vehicle manufacturing,3364OT,336O,Other transportation equipment,Other transportation equipment
336500,Railroad rolling stock manufacturing,3364OT,336O,Other transportation equipment,Other transportation equipment
336611,Ship building and repairing,3364OT,336O,Other transportation equipment,Other transportation equipment
336612,Boat building,3364OT,336O,Other transportation equipment,Other transportation equipment
336991,"Motorcycle, bicycle, and parts manufacturing",3364OT,336O,Other transportation equipment,Other transportation equipment
336992,"Military armored vehicle, tank, and tank component manufacturing",3364OT,336O,Other transportation equipment,Other transportation equipment
336999,All other transportation equipment manufacturing,3364OT,336O,Other transportation equipment,Other transportation equipment
337110,Wood kitchen cabinet and countertop manufacturing,337,3370,Furniture and related products,Furniture and related products
337121,Upholstered household furniture manufacturing,337,3370,Furniture and related products,Furniture and related products
337122,Nonupholstered wood household furniture manufacturing,337,3370,Furniture and related products,Furniture and related products
337127,Institutional furniture manufacturing,337,3370,Furniture and related products,Furniture and related products
337215,"Showcase, partition, shelving, and locker manufacturing",337,3370,Furniture and related products,Furniture and related products
337900,Other furniture related product manufacturing,337,3370,Furniture and related products,Furniture and related products
339112,Surgical and medical instrument manufacturing,339,338A,Miscellaneous manufacturing,Miscellaneous manufacturing
339113,Surgical appliance and supplies manufacturing,339,338A,Miscellaneous manufacturing,Miscellaneous manufacturing
339114,Dental equipment and supplies manufacturing,339,338A,Miscellaneous manufacturing,Miscellaneous manufacturing
